<?xml version="1.0" encoding="ISO-8859-1"?>

<fingerbook xmlns="http://www.fingerbook.com/DataSchema" xmlns:xsi="http://www.w3.org/2001/XMLSchema-instance"
	xsi:schemaLocation="http://www.fingerbook.com/DataSchema fingerData.xsd">

	<fingerprints>
		<fileInfo>
			<name>fifa.exe</name>
			<shaHash>OEIRJDHTRGOEIRJDHTRGOEIRJDHTRGOEIRJDHTRG</shaHash>
			<sizeInBytes>1243</sizeInBytes>
		</fileInfo>
	</fingerprints>

	<userInfo>
		<user>p3pito</user>
		<mail>pepe_sanchez@jmail.com</mail>
	</userInfo>
</fingerbook>
